id,text
1,"Psycho Mods is a technology focused project that explores cybersecurity and artificial intelligence"
2,"I am interested in learning about cybersecurity and protecting people from online threats"
3,"My goal is to create awareness about hacking prevention and digital safety"
4,"I work on artificial intelligence projects and experiment with machine learning models"
5,"I explore how neural networks can solve real world problems using data"
6,"I am interested in programming and building useful technology applications"
7,"Cybersecurity is important because digital systems need protection from attackers"
8,"I believe awareness and education can help people stay safer online"
9,"I like creating technology projects that combine creativity and problem solving"
10,"Artificial intelligence is a field that helps computers learn from information"
11,"I experiment with AI models to understand how modern systems work"
12,"Machine learning helps developers create applications that can recognize patterns"
13,"I enjoy improving my skills in programming and artificial intelligence"
14,"Building projects helps me understand technology better through practical experience"
15,"Cybersecurity requires knowledge about networks systems and safe computing practices"
16,"I want to create solutions that help people understand technology"
17,"Technology education can make the internet safer for everyone"
18,"I explore different programming concepts and development techniques"
19,"AI and cybersecurity are two important areas shaping the future of technology"
20,"I am interested in developing intelligent applications using modern tools"
21,"Learning new technologies helps me improve my problem solving abilities"
22,"I work on projects that involve software development and artificial intelligence"
23,"Security awareness is necessary because online threats are constantly evolving"
24,"I believe technology should be used responsibly and creatively"
25,"My projects focus on learning experimenting and building useful systems"
26,"Artificial intelligence and cybersecurity provide many opportunities for innovation"
27,"I continue exploring new ideas in programming and computer science"
28,"Creating technology projects helps transform ideas into practical applications"
29,"I am interested in understanding how advanced computer systems operate"
30,"The future of technology depends on innovation learning and responsible development"